{"closureDigest":{"sha256":"8c13490145ccdfe6958163ef0c578afb57da07772c2071932f8a4d98870e776e"},"critical":true,"digest":{"sha256":"31934d2cf8fa7b5af2f8e4cf591d96278c4f59ddb6bb190afccb93701244f9eb"},"id":"https://schemas.example.internal/makoto/public-transform-metadata-v1.schema.json","resources":[],"target":"predicate"}
