{"closureDigest":{"sha256":"c02fed306cd6300d537c2664ad88b877dc5605b49b7d9dd0d03bf6c6332b6687"},"critical":true,"digest":{"sha256":"a6196356b740d8f7c72bce9093956c1e9457a8479a7b13269d00f9ff51af2f86"},"id":"https://usemakoto.dev/profiles/v0.2/origin-l3-reference-v1.schema.json","resources":[],"target":"predicate"}
